<?xml version="1.0" encoding="UTF-8"?>
<xs:schema xmlns:xs="http://www.w3.org/2001/XMLSchema">
    <xs:element name="recetas">
        <xs:complexType>
            <xs:sequence>
                <xs:element name="receta" maxOccurs="unbounded">
                    <xs:complexType>
                        <xs:sequence>
                            <xs:element name="nombre" type="xs:string" />
                            <xs:element name="tipo">
                                <xs:complexType>
                                    <xs:attribute name="definicion" use="required" />
                                </xs:complexType>
                            </xs:element>
                            <xs:element name="dificultad" type="xs:string" />
                            <xs:element name="calorias" type="xs:string" />
                            <xs:element name="tiempo" type="xs:string" />
                            <xs:element name="elaboracion" type="xs:string" />
                            <xs:element name="ingredientes">
                                <xs:complexType>
                                    <xs:sequence>
                                        <xs:element name="ingrediente" maxOccurs="unbounded">
                                            <xs:complexType>
                                                <xs:simpleContent>
                                                    <xs:extension base="xs:string">
                                                        <xs:attribute name="cantidad" use="required" />
                                                    </xs:extension>
                                                </xs:simpleContent>
                                            </xs:complexType>
                                        </xs:element>
                                    </xs:sequence>
                                </xs:complexType>
                            </xs:element>
                        </xs:sequence>
                        <xs:attribute name="id" type="xs:integer" use="required" />
                    </xs:complexType>
                </xs:element>
            </xs:sequence>
        </xs:complexType>
    </xs:element>
</xs:schema>